{
  "meta": {
    "runName": "demo-run",
    "schemaVersion": 1,
    "createdAt": "2026-07-12T00:00:00Z",
    "baseBranch": "main",
    "integrationBranch": "fleet/demo-run/int",
    "maxConcurrent": 3
  },
  "git": {
    "remote": "https://github.com/example/repo",
    "webTemplate": "https://github.com/example/repo/commit/{sha}"
  },
  "dags": [
    {
      "id": "d1",
      "ref": "specs/<spec-name>.md",
      "title": "<dag-title>",
      "statePath": "dags/d1/state.json",
      "dependsOn": [],
      "status": "pending",
      "judge": { "verdict": null, "attempt": 0 },
      "attributes": {},
      "audit": []
    }
  ],
  "stopFlag": { "stopped": false, "reason": null, "stoppedAt": null }
}
